{
  "contract_version": "1.0",
  "run_id": "example-complete-run",
  "status": "complete",
  "started_at": "2026-01-01T00:00:00Z",
  "completed_at": "2026-01-01T00:01:00Z",
  "provider_catalogs": {
    "aws": {
      "status": "complete",
      "usable": true,
      "source_url": "https://example.com/aws-ranges.json",
      "retrieved_at": "2026-01-01T00:00:01Z",
      "snapshot_id": "aws-example-1"
    },
    "gcp": {
      "status": "complete",
      "usable": true,
      "source_url": "https://example.com/gcp-ranges.json",
      "retrieved_at": "2026-01-01T00:00:02Z",
      "snapshot_id": "gcp-example-1"
    },
    "azure": {
      "status": "cached",
      "usable": true,
      "source_url": "https://example.com/azure-ranges.json",
      "retrieved_at": "2025-12-31T00:00:00Z",
      "snapshot_id": "azure-example-1"
    }
  },
  "outputs": {
    "actionable_targets": "allocator-targets-v1.json",
    "observations": "dns-observations-v1.json"
  }
}
